{
  "opera_riferimento": {
    "titolo": "Antartica - Quasi una fiaba",
    "autore": "Lucia Calamaro"
  },
  "testo_finale": {
    "titolo": "La vita sotto il ghiaccio: conservare o trasmettere",
    "sottotitolo": "Una lettura di «Antartica - Quasi una fiaba» di Lucia Calamaro, tra il desiderio di non finire e l'incontro con ciò che il tempo non restituisce",
    "corpo_del_testo": "## Croci sulla neve\n\nC'è un'immagine che le recensioni di *Antartica - Quasi una fiaba* restituiscono con insistenza, e conviene partire da lì. Piccole croci piantate nella neve, accanto al laboratorio, a segnare il punto in cui un esperimento è fallito, il punto in cui un essere vivo non è tornato. Va detto subito, una volta per tutte: chi scrive non ha potuto vedere il film. Questa lettura poggia su recensioni, schede e un'intervista alla regista, non sulla visione diretta. Eppure quell'immagine, anche solo riferita, dice già molto. Una piccola comunità di scienziati, isolata per otto mesi l'anno in una base antartica, lavora per riportare la vita dal congelamento — per sospendere la morte, differirla, magari vincerla. E ogni volta, a pochi passi dal luogo in cui si tenta di rianimare la vita, cresce un piccolo cimitero. La tecnica promette che tutto possa tornare indietro; la neve restituisce tombe.\n\nÈ l'esordio cinematografico di Lucia Calamaro, drammaturga di teatro, uscito nel 2026; il sottotitolo, «quasi una fiaba», andrà preso sul serio fino in fondo. Perché è proprio in quello scarto — tra la promessa di reversibilità e le croci che si moltiplicano — che il film sembra trovare il proprio centro.\n\n## Due modi di non morire del tutto\n\nProviamo a dire di che cosa parla davvero questo film. Non, in fondo, di scienza, anche se la scienza è in primo piano; non di capitalismo, anche se il capitale vi entra con forza; non dell'isolamento, per quanto otto mesi di buio condiviso pesino su ogni inquadratura. *Antartica* mette in forma qualcosa di più antico e più semplice: il desiderio umano di non passare, di strappare la vita al tempo. E lo fa articolandolo in due modi opposti di provarci, che tiene in tensione senza mai scegliere tra loro.\n\nIl primo è conservare. Congelare, ibernare, fermare tutto nel ghiaccio: custodire ciò che si è, intatto, sottraendolo al divenire. È la via che il film raccoglie nell'immagine della «città di ghiaccio» vagheggiata dall'anziano capomissione, e che il mondo, poco più in là, traduce nel brevetto — la scoperta recintata, resa proprietà. Il secondo modo è trasmettere: continuare non in sé, ma in un altro; consegnare a chi viene dopo ciò che si è scoperto e ciò che si è. Dal maestro all'allieva e, forse — qui le fonti non concordano — dal padre alla figlia.\n\nTra i due modi il film tende un filo ironico che ne è il vero cuore. A guidare la ricerca contro la morte è un uomo che sta morendo. La scoperta che potrebbe sospendere la fine non salverà il suo scopritore. E proprio questo costringe a chiedersi quale «sopravvivenza» sia davvero in gioco: non quella del corpo conservato nel freddo, ma quella di ciò che si passa ad altri. Non si vince la morte fermando la vita; semmai consegnandola.\n\nDi qui anche il «quasi» del sottotitolo. La fiaba prometterebbe il lieto fine; questa si arresta un passo prima, sulla soglia. È la forma con cui il film tiene viva una speranza senza poterla garantire. Spostare in questo modo lo sguardo — dal «di che cosa parla» a quale esperienza umana il film mette in forma — è ciò che consente di leggere la scienza, l'etica e l'isolamento non come temi separati, ma come i luoghi in cui un unico desiderio prende corpo: la scienza è dove la voglia di permanenza si fa tecnica, l'etica dove diventa, o no, bene condiviso, l'isolamento la stanza chiusa in cui la finitudine non ha distrazioni.\n\n## Il limite che non torna\n\nMa la trasmissione ha senso solo di fronte a qualcosa che andrebbe altrimenti perduto: prima di seguirla conviene sostare sul polo opposto, il limite contro cui ogni conservazione si infrange. Il punto in cui questa posta si fa più nitida è la serie, ricorrente, degli esperimenti di ibernazione che falliscono. Le recensioni parlano di animali sottoposti al congelamento e non più risvegliati — e di nuovo quelle croci, contabilità muta degli insuccessi. Qui il film tocca qualcosa che vale la pena nominare con precisione: il punto in cui il tempo non restituisce ciò che è stato. Il fallimento, ripetuto, non è un ostacolo tecnico in attesa della soluzione giusta; è la forma quotidiana con cui il reale resiste e toglie.\n\nLa distinzione è sottile ma decisiva. Un conto è il «non si deve» di una regola — un divieto, che per definizione si può sempre aggirare o infrangere. Altro è il «non è possibile» di un limite, che non si tratta ma si incontra. Gli esperimenti di *Antartica* urtano contro il secondo: non un confine morale, ma una sproporzione tra ciò che si intende e ciò che accade. La vita riportata indietro non torna come prima, o non torna affatto.\n\nA questo limite corrisponde, dall'altra parte, una tentazione precisa: che il mondo finisca per coincidere con ciò che desideriamo, che ciò che non funziona possa sempre essere aggiustato. La «città di ghiaccio», l'ostinazione a conservare, si lasciano leggere come la forma di un desiderio che si stringe sull'arresto del tempo per controllare l'inarrestabile. Conviene però essere prudenti — ed è una prudenza che riguarda il modo stesso di guardare. Non si tratta di diagnosticare il capomissione, di dirlo «rigido» o «ossessionato»: quegli aggettivi apparterrebbero a un ritratto clinico che il film non chiede. Si tratta piuttosto di riconoscere la tonalità che l'opera dispone attorno a lui — un clima in cui la vita vale nella misura in cui la si trattiene. Il personaggio non è il caso da analizzare; è il luogo in cui quella tonalità diventa visibile.\n\n## Il monologo, o la tenuta della perdita\n\nSe gli esperimenti mostrano il limite dal lato del fallimento, il finale lo mostra dal lato di chi lo affronta in prima persona. Le fonti descrivono un monologo conclusivo: il capomissione, anziano e malato, in penombra e in un'atmosfera onirica, davanti alla propria morte; e un'immagine finale che la critica dice sorprendente. È il momento in cui il film smette di parlare di scienza e parla di un uomo davanti alla fine. Più di una recensione vi avverte un'eco di Čechov — l'invito a continuare nonostante le sconfitte.\n\nLetto nella sua direzione più feconda, questo monologo è una tenuta della perdita: non la rimozione dell'irreversibile, ma il gesto di abitarlo senza spiegarlo e senza promettere nulla. È qui che il trattenere potrebbe convertirsi in trasmettere. Il desiderio non si spegne: persevera attraverso la rinuncia, e nel rinunciare a fermare la vita la consegna a chi resta. Chi se ne va affida, chi resta raccoglie. Sarebbe la seconda delle due figure che finalmente prende il sopravvento sulla prima.\n\nE però — è la prudenza che il film stesso impone con il suo «quasi» — non è dato saperlo. Dalle fonti non si può decidere se quel monologo converta davvero in consegna o si limiti a sospendere. Il registro fiabesco, luminoso, può sostenere autenticamente la perdita, darle dignità senza addomesticarla; oppure può addolcirla, ammorbidire l'irreversibile in una consolazione che lo rende sopportabile a buon mercato. Le due letture restano affiancate, e non per cautela diplomatica: è il nodo più resistente dell'opera, il punto in cui il «quasi» smette di essere un vezzo del titolo e diventa la cifra di un'indecidibilità voluta. Forzarne lo scioglimento in un senso o nell'altro tradirebbe ciò che il film tiene, deliberatamente, in bilico.\n\n## Decidere insieme: la vita come bene comune o merce\n\nC'è poi un momento che sposta tutto questo dal singolo alla comunità. I finanziamenti pubblici alla missione vengono meno; una multinazionale si offre di sostenerla, a una condizione: poter brevettare e commercializzare la scoperta. Il gruppo si riunisce e vota. È una scena di deliberazione collettiva, senza garanzie, in cui ciascuno deve prendere su di sé una decisione esposta e fallibile, sotto la pressione del capitale e la scarsità delle risorse — non l'applicazione di una regola già scritta, ma un giudizio che potrebbe sbagliare e di cui si risponde in prima persona.\n\nL'oggetto del voto non è neutro. Brevettare la scoperta significa decidere a chi appartiene la vita conservata: se sia un dono da condividere o una proprietà da recintare. E la domanda che il film fa affiorare, qui, non riguarda quanto si desideri — quanto si voglia salvare la ricerca — ma in quale direzione: verso il bene comune o verso la merce. È lo stesso desiderio di permanenza, piegato in due sensi opposti.\n\nVale la pena dire con esattezza che cosa fa questa linea del film, perché è facile fraintenderla. Il capitale non inventa il dramma della finitudine; lo traduce. La ricerca che «vale solo finché rende», il tempo scandito da scadenze e rendicontazioni, il dirigente che arriva da fuori a mettere un prezzo sulla promessa di vincere la morte: tutto questo è il modo storicamente determinato in cui il desiderio di non finire entra nel mondo e vi si deforma. Leggere *Antartica* come semplice denuncia del capitalismo lo impoverirebbe; riconoscere nel capitale la lingua contemporanea di una posta molto più antica gli restituisce la sua profondità.\n\n## Il ghiaccio: archivio e arresto\n\nResta l'elemento che attraversa tutto il film: il ghiaccio. La regista lo ha descritto come una materia dalla «vocazione conservativa, quasi museale». Ed è esattamente questo doppio volto a renderlo il cuore simbolico dell'opera. Il ghiaccio è un archivio: le carote estratte conservano aria di centinaia di migliaia di anni fa, custodiscono il tempo profondo come una memoria intatta. Ma è anche la promessa di fermarlo, quel tempo, di trattenere la vita contro il suo stesso fluire.\n\nIn una sequenza onirica le carote collassano, e la critica vi legge una «frat